{
  "run_id": "2026-07-19-sample",
  "project_id": "sample",
  "mode": "full",
  "metrics": {
    "open_confirmed_p0": 0,
    "open_confirmed_p1": 1,
    "open_supported_p1": 0,
    "baseline_test_status": "passed",
    "protected_baseline_modified": false,
    "required_integration_test_not_run": false,
    "migration_replay_required": false,
    "migration_replay_verified": false,
    "accepted_residual_risk_count": 0,
    "required_runtime_evidence_missing": false,
    "required_tests_passed": true
  },
  "findings": [
    {
      "id": "SAMPLE-REC-001",
      "title": "Cursor omits a unique tie-break field",
      "category": "domain.recommendation.pagination",
      "severity": "P1",
      "confidence": "CONFIRMED",
      "status": "OPEN",
      "scope": {
        "files": [
          "src/RecommendationCursor.java"
        ],
        "symbols": [
          "RecommendationCursor#from"
        ]
      },
      "evidence": [
        {
          "level": "E1",
          "type": "code",
          "location": "RecommendationCursor.java:41-58",
          "summary": "Cursor contains score and timestamp but no unique identifier."
        },
        {
          "level": "E3",
          "type": "test",
          "command": "./gradlew test --tests CursorTieTest",
          "result": "failed before remediation",
          "summary": "Equal score and timestamp cause duplicate or missing continuation."
        }
      ],
      "reproduction": {
        "preconditions": [
          "Two items share score and timestamp"
        ],
        "steps": [
          "Fetch page one",
          "Use cursor",
          "Fetch page two"
        ],
        "observed": "Duplicate or missing item",
        "expected": "Stable non-overlapping continuation"
      },
      "impact": "Pagination integrity is not guaranteed under complete ties.",
      "recommended_action": "Add a stable unique key to ordering and cursor serialization.",
      "verification": [
        "./gradlew test --tests CursorTieTest",
        "./gradlew test"
      ]
    }
  ]
}
